{
  "chunk_id": "DOC-WHO-CARD-0001-CH-0001",
  "document_id": "DOC-WHO-CARD-0001",
  "source_id": "SRC-WHO-001",
  "medical_specialty": "Cardiology",
  "topics": [
    "hypertension",
    "blood pressure",
    "antihypertensive treatment"
  ],
  "source_block_index": 12,
  "source_block_sha256": null,
  "block_type": "recommendation",
  "section_number": null,
  "section_level": 0,
  "parent_section_number": "3.1",
  "parent_section_heading": "Blood pressure threshold for initiation of pharmacological treatment",
  "section_path": [
    "3 Recommendations",
    "3.1 Blood pressure threshold for initiation of pharmacological treatment"
  ],
  "heading": "1. RECOMMENDATION ON BLOOD PRESSURE THRESHOLD FOR INITIATION OF PHARMACOLOGICAL TREATMENT",
  "start_page": 19,
  "end_page": 19,
  "chunk_index": 1,
  "chunk_count_in_block": 1,
  "is_split": false,
  "text": "WHO recommends initiation of pharmacological antihypertensive treatment...",
  "character_count": 74,
"content_sha256": "c3b62d60c9cee899e0e4fadfd7cb25f603e522742f3aa0ab06bc34a5301353d2"
}